title,upvotes,num_comments,content,language
 forget about masterchef i give you the german even splitting championship ,8761349,1923,Video,en
 when you know you are next ,9474761,1916,Video,en
 asian pops doing taking beyblade to another level ,8761349,1923,Video,en
 saw the neighbor kids playing with fire so i pulled out my phone ,4529015,810,Video,en
 insane results in 6 months ,10809125,1856,Video,en
 footage of meteor that was seen last night in portugal ,8761349,1923,Video,en
 david beckham is not letting this go ,3123718,908,Image,en
 do you smoke ,10412154,260,Video,sk
 trying to squeegee a helmet ,7533703,1357,Video,en
 catching a ball from 1000ft 304m ,8761349,1923,Video,en
 this is a coop game not pvp ,1326077,1336,Image,en
 bro defying laws of physics ,8761349,1923,Video,en
 another thing boomers were wrong about relevant today ,580899,857,Image,en
 in your face karen ,580899,857,Video,tr
 two dogs digging a hole got busted by the owner ,6692425,1517,Video,en
 nice catch dad ,4529015,810,Video,en
 going to the gym ,8761349,1923,Video,en
 my uplifting post ,59809598,2283,Video,en
 entitled boomer tells neighbour to disable wifi password ,580899,857,Video,en
 this is how they put sleeping bags in the carry bag at the factory ,15345939,1705,Video,en
 boomer shocked that his middle finger didnt strike the fear of god into another adult ,580899,857,Video,en
 thats what experience looks like ,10809125,1856,Video,en
 firefighter putting out a fire using bernoullis principle ,15345939,1705,Video,en
 is this what asian kids do when they get upset ,10809125,1856,Video,en
 insane match ,9474761,1916,Video,en
 skier sliding over lakes surface using momentum ,8761349,1923,Video,da
 that time a boomer almost smacked her hairstylist ,580899,857,Video,en
 destroyed him with a big smile ,8761349,1923,Video,en
 election officer tampering with votes realizes that theres a cctv camera right above him ,6692425,1517,Video,en
 it is so confusing ,820992,16,Image,en
 breaking news headline ,9474761,1916,Video,en
 cops get hit by cops get struck by a smooth criminal ,8761349,1923,Video,en
 what those legs do ,2465668,21,Video,en
 boomer learns about boundaries the hard way from bank photographer ,580899,857,Video,en
 how root canals work ,12082794,4411,Video,en
 its his now ,6029799,982,Video,en
 what is the whole food chain shenanigan is this ,10809125,1856,Video,en
 a concrete wall falls because of a box leaning against it ,6692425,1517,Video,en
 driving like an idiot through traffic ,7533703,1357,Video,en
 2 girls practice their catwalkonly to realize theyve been caught on camera  ,6692425,1517,Video,en
 nasty way to go ,32588,5,Image,pl
 smooth operator the art of waterslide entry ,10784446,653,Video,en
 making one last cut before your break ,10809125,1856,Video,en
 gold diggers  credit kevinliu ,10809125,1856,Video,af
 jontron gets brutally murdered by a brick ,3284218,27,Video,en
 never gets old  ,4529015,810,Video,da
 walking past a banh mi shop on a street in vietnam ,12082794,4411,Video,en
 red robin ,5842213,34,Image,en
 russias most modern tank the t90m getting smacked by a us bradly with a 25mm cannon ,12082794,4411,Video,en
 quick reaction there ,8761349,1923,Video,en
 boxer encouraging opponent he defeated ,5842213,34,Video,en
 bully got bullied ,357130,44,Video,cy
 never walk under these red flags when you visit oslo norway ,15345939,1705,Video,en
 phone dead about to explode ,6692425,1517,Video,en
 now he know why ,3527517,495,Video,en
 iron nail slingshot ,12082794,4411,Video,tl
 draw it i get it ,10809125,1856,Video,nl
 boomer tortoise landed on shell soft pathetic underbelly exposed ,580899,857,Video,en
 would they ,820992,16,Image,en
 different generations asking for a table ,580899,857,Video,en
 twist x twist ,10809125,1856,Video,pl
 they put my ass on fucking tv ,1989536,109,Image,en
 american and french firefighter helmet designs ,15345939,1705,Video,en
 the kid is great at maths ,4529015,810,Video,en
 ive never seen a corn like this before ,10809125,1856,Video,en
 wcgw by playing flamethrower inside a public transport bus ,7533703,1357,Video,en
 some guys just thrive in marriage ,9474761,1916,Video,en
 guy jumps on hood of a school bus after a student threw a water bottle that hit his car ,580899,857,Video,en
 that f microsoft is personal ,59809598,2283,Video,en
 farewell battle brother ,1326077,1336,Image,en
 escaped horses galloping around london today ,1032615,14,Image,en
 mj realizing they are taking his photo whenever he moves ,59809598,2283,Video,en
 bruhhhh ,3527517,495,Video,cs
 his soul disappeared ,59809598,2283,Video,en
 how cast saws dont hurt your skin ,15345939,1705,Video,en
 guy trips down stares hits fire alarm ,6692425,1517,Video,en
 this way he shows proof that its not sped up ,2920920,19,Video,en
 parking problems ,10809125,1856,Video,no
 aggressively passing with an unsecured washing machine what could go wrong ,83909,96,Video,en
 before and after powerful 6 month journey to weight loss ,1018525,28,Video,en
  ,4232957,325,Video,Unknown
 maybe maybe maybe ,3272091,502,Video,so
 germans arent the best engineers whats this then ,7923829,2269,Video,en
 boss man strikes again    ,1326077,1336,Image,id
 aita for being truthful and admitting that i find my wife unattractive after her surgery ,1671542,4044,Image,en
 rotating body trick ,10809125,1856,Video,en
 humans attempting to escape from giant glue trap ,7923829,2269,Video,en
 cutting hair equally ,7533703,1357,Video,en
 my wife just out of the shower checking email ,1032615,14,Image,en
 13yearold makes history as first person ever to beat original tetris ,8761349,1923,Video,en
 5 years after the original post showing my grandma playing wii fit every morning for 10 years im excited to update you that she is still going she wakes up every morning and does excercises to stay fit almost at 16 years ,41233066,2844,Image,en
 could you throw needle like that ,7923829,2269,Video,en
 custom made gta vi ps5 ,8761349,1923,Video,pt
 decided to fly my ncr flag and my neighbor chose violence ,1523009,729,Video,en
 taking dads hat off of his head ,10809125,1856,Video,en
 kitty saves itself from cobra attack ,8761349,1923,Video,en
 everything original is simple ,7923829,2269,Video,en
 lasso man ,2467893,543,Video,tl
 gravity across the solar system ,12082794,4411,Video,en
 bro has no enemies ,1014958,135,Video,es
 giving your daughters stuffed animal an aerial tour of the neighborhood ,7533703,1357,Video,en
 the father daughter energy is unrivaled ,10412154,260,Video,en
 floating garbage bins ,15345939,1705,Video,da
 beating the system ,10809125,1856,Video,en
 guy humbles the strongest man in the world ,8761349,1923,Video,en
 high speed tablecloth pull ,10784446,653,Video,en
 when big machines and men meet little boys with trucks ,5842213,34,Video,en
 drone pics of north korea i was in china my drone flew across the border ,30828228,5331,Video,en
 texas secessionist boomers asking the important questions rofl ,580899,857,Image,en
 the first in olympic history ,5842213,34,Video,en
 sitting on a escalator ,7533703,1357,Video,en
 they deserve it fuck shit cunt ,331213,21,Image,en
 stone epoxy glass cerium oxide  polishing powder voila ,7923829,2269,Video,en
 he thinks hes bruce lee ,10412154,260,Video,en
 bro definitely wanted an excuse to use the laser ,59809598,2283,Video,en
 in one of the last automaton missions a fellow helldiver took this picture he called it the last automaton ,1326077,1336,Image,en
 is it a cake or a soda ,10809125,1856,Video,en
 ball control is crazy ,8761349,1923,Video,it
 my kitty was stuck in reboot loop while recovering from sedation ,575500,175,Video,en
 person taking this video does not recognize how potentially dangerous this could be fortunately this good doggo does and is on it ,6856277,51,Video,en
 this one of the truest titles ive ever read ,1326077,1336,Image,en
 this is why you never go past the tree line ,2502762,674,Video,en
 my stepfather finally got consequences ,357130,44,Image,en
 sweet sweet chocolate ,10809125,1856,Video,nl
 he was eating somebody elses leftovers but she took it away and gave him fresh food  ,9474761,1916,Video,en
 when your dad says he wants to talk man to man ,1014958,135,Video,en
 that one move that you see in the movies ,8761349,1923,Video,en
 got a plant ,1989536,109,Image,ca
 meirl ,2746008,1217,Video,pt
 arnold schwarzenegger got stuck at customs at munich airport ,30828228,5331,Image,en
 boys being boys ,10412154,260,Video,cy
 this woman leaves a container of water outside for wild animals animals drink from it  bear cubs even play in it ,5842213,34,Video,en
 alright lets go billie ,458779,36,Video,fr
 i cant be the only one ,1326077,1336,Image,en
 its nice to be creative these days ,59809598,2283,Video,en
 iconic moment during the opening ceremony of barcelona 1992 when the olympic flame was lit by archer antonio rebello ,8761349,1923,Video,en
 a wild crow is a friend to a child ,6856277,51,Video,en
 man cut through the tip of the roof to save the cat from a fully flooded house ,5842213,34,Video,en
 cologne cathedral germany ,7923829,2269,Video,en
 helpful tool tips ,10809125,1856,Video,en
 fuck im down for this ,331213,21,Image,en
 its enough to make a grown helldiver cry ,1326077,1336,Image,en
 definitely not oj ,10412154,260,Video,en
 big w playstation ,41233066,2844,Image,tl
 the pressure difference game ,4232957,325,Video,en
 check this out ,580899,857,Video,en
 cyclist went twice as fast in the final moments of the race ,8761349,1923,Video,en
 what the frack ,7533703,1357,Video,en
 huge kid playing rugby is unstoppable ,8761349,1923,Video,en
 boomer landlord being a karen to the tenant ,580899,857,Video,en
 cat how it started and how its going ,9474761,1916,Video,en
 23m took all your advice swipe ,1989536,109,Video,en
 this girl has a jumping spider on her jeansand then ,1018525,28,Video,en
 train in southern germany tilts in curves to go faster ,15345939,1705,Video,en
 what could go wrong he is cool ,7533703,1357,Video,en
 to really show him he should buy 100 copies ,2118271,1320,Image,en
 perfectly hand chopped wood ,10784446,653,Video,en
 this pull up or whatever its called ,8761349,1923,Video,en
 tourist behind plane for thrill ,7533703,1357,Video,en
 beijing resolves traffic jam pressure by widening lanes ,12082794,4411,Video,en
 literally me ,2055720,812,Image,en
 cristiano ronaldos insane 9 feet jump ,8761349,1923,Video,pt
 our engine has the best physics ,59809598,2283,Video,en
 awesome chief ,16223674,701,Image,en
 how do you plead ,10809125,1856,Video,cy
 girl throws lemonade at the one holding the pressure washer ,357130,44,Video,en
 hit and run ,7533703,1357,Video,en
 smooth operator ,5842213,34,Video,en
 mother sees an intruder on baby monitor ,10809125,1856,Video,en
 what a weight loss journey she looks so much happier now ,9474761,1916,Video,en
 homeowner was told to remove the eyesore that was his boat in the driveway so he painted a mural ,30828228,5331,Video,en
 zoo has hole so you can hold otters paws ,10784446,653,Video,en
 this horse waited his whole life for this moment ,8387295,68,Video,en
 found this on facebook ,3629567,56,Image,en
 lacking person space ,580899,857,Video,en
 aitah for announcing our pregnancy at my brothers wedding after he proposed at mine ,1671542,4044,Image,en
 bodybuilder receives award from arnold schwarzenegger and is instantly starstruck ,9474761,1916,Video,en
 more on the nintendo vs palworld situation  credit to rdcworld1 ,532819,84,Video,en
 having lost a mailbox this story made me smile ,357130,44,Image,en
 jump ,4529015,810,Video,lv
 poor kitties stabbed mercilesly and screaming in pain ,3284218,27,Video,en
 boomer takes a stand against crt ,580899,857,Video,en
 boomer leans on desk ,580899,857,Video,da
 building fish tower in a pond ,15345939,1705,Video,en
 the interraction that can make a grown man cry ,1326077,1336,Image,en
 christoph waltz appreciation post ,197775,226,Image,en
 poor people dont even know  ,3527517,495,Video,en
 hell no my anxiety could never handle this ,3527517,495,Video,en
 the cat better be getting paid for that ,8761349,1923,Video,en
 honesty is the best policy ,1326077,1336,Image,en
 challenge accepted ,9474761,1916,Video,en
 camera operator showing off his skating skills ,1301840,21,Video,en
 cat is dumbfounded by his turtle buddy ,2465668,21,Video,en
 easy way to make money ,2118271,1320,Image,en
 eagle perfect fly ,8761349,1923,Video,en
 dude did a face reveal when face reveal were even a thing ,455036,71,Video,en
 they get into a fight in the store ,580899,857,Video,en
 this boiling egg timeline thanks to whoever created this ,10784446,653,Image,en
 guy and cat get a scare ,6692425,1517,Video,en
 sometimes the world is fair ,9474761,1916,Video,en
 maybe maybe maybe ,3272091,502,Video,so
 incredible facial reconstruction after horrendous burn ,12082794,4411,Image,en
 her fingers must train golds gym ,8761349,1923,Video,en
 lets give it up to the only character in the entire show who bothered to read the logs for backstory ,1523009,729,Image,en
 my elderly mother doesnt want to move she is now surrounded by new townhouses in all directions ,30828228,5331,Image,en
 take note guys ,1123014,487,Video,af
 this womans charger in my row during a 6 hour red eye flight ,7613904,2471,Video,en
 breaking character ,9474761,1916,Video,en
 maybe maybe maybe ,3272091,502,Video,so
 fukang meteorite that fell in the mountains near fukang china it is estimated to be 45 billion years old ,7923829,2269,Video,en
 bro youre the foot ,2118271,1320,Image,en
 cia ,192584,29,Video,pt
 twinning at life ,10412154,260,Video,en
 japanese buildings utilize seismic isolation bearings ,7923829,2269,Video,en
 the best big brother ever ,9474761,1916,Video,en
 guinness record of 61meter hand throw by irans goalkeeper alireza beiranvand ,2920920,19,Video,en
 siri listens well ,10809125,1856,Video,de
 the good ol days ,1123014,487,Image,en
 a mini mortar ,15345939,1705,Video,ca
 the portal art installation connecting nyc to dublin has been shut down ,30828228,5331,Image,en
 unintentional object drop into rotary table on an oil rig ,6692425,1517,Video,en
 holy spirit activate ,4232957,325,Video,en
 hannah waddinghams response to a photographer asking her to show leg youd never say that to a man my friend ,3123718,908,Video,en
 i just bought my first house ,1989536,109,Image,en
 revival time ,1244708,7,Image,it
 asked samsungs ai to remove the black car in the photo ,7613904,2471,Video,en
 jerk driver tries to brake check with the hand brake ,83909,96,Video,en
 update on finding my wife unattractive after her plastic surgery ,1671542,4044,Image,en
 the way the letters appear ,10784446,653,Video,en
 my boy buster 4yo has completely changed from black to white over the course of the last 25 years ,36016549,2281,Video,en
 night vision has come a long way ,15345939,1705,Video,en
 then they became best friends ,9474761,1916,Video,en
 we did it veld is ours ,1326077,1336,Image,af
 selfaware ,5816101,1484,Video,af
 rescue lynx has her own pet cat ,6856277,51,Video,en
 sylvester stallone paid 1m from his own salary to stuntman simon crane to perform a plane to plane transfer via zip line ,8761349,1923,Video,en
 woman does perfect robot ,2920920,19,Video,en
 is there a pay to pet ,10412154,260,Video,en
 bro picked the small frame trait ,1523009,729,Image,en
 the doordasher sent me this confirmation photo ,390828,68,Image,en
 everyone in the comments seems to know but me ,611760,538,Image,en
 durability ,7923829,2269,Video,tl
 a defiant michelle phillips eating a banana during the mamas and the papas performance of california dreaming on the ed sullivan show because they had to lip sync  1967 ,18524460,333,Video,en
 a gang of robber crabs invade a family picnic in australia ,30828228,5331,Video,en
 just witnessed a maybe once in a lifetime thing  ,7923829,2269,Video,en
 i found a rock that looks exactly like a piece of bread ,293909,55,Image,en
 my boss doesnt speak good english so i get texts like this often ,1726893,96,Image,en
 guy holds down attacking dog until owner arrives ,8761349,1923,Video,en
 wcgw doing a drag race ,7533703,1357,Video,cy
 probably the greatest reaction to an entitled boomer ive seen in years ,580899,857,Image,en
